{
  "id": "ratatouille",
  "version": 1,
  "track": "core",
  "unit": 1,
  "title": "Ratatouille",
  "image": "dishes/ratatouille.png",
  "cuisine": "french",
  "skill": "Dicing: eggplant, zucchini, pepper, tomato",
  "skills": ["dicing", "simmering"],
  "prereqs": [],
  "servings": 6,
  "totalMinutes": 70,
  "scaling": {
    "mode": "free",
    "notes": [
      { "from": 9, "text": "For more than 8, brown the eggplant in two batches so it doesn't crowd the pot, and use your biggest pot." }
    ]
  },
  "learn": {
    "move": {
      "title": "A pile of cubes becomes a stew",
      "body": "Dicing means cutting food into cubes that are all about the same size. Today you'll dice five different vegetables, brown some of them, and let them all simmer together into ratatouille, a French vegetable stew."
    },
    "why": [
      { "id": "grid", "title": "Planks, sticks, cubes", "body": "Every dice works the same way. Cut flat planks, cut the planks into sticks, then cut across the sticks. Each cut across a row of sticks makes a whole row of cubes, and if the planks and sticks were even, the cubes are too." },
      { "id": "flat-first", "title": "Round things get a flat side", "body": "Eggplant and zucchini are round, and round food rolls under a knife. Cut them in half the long way first, then lay the flat side on the board. Now they sit still for every cut that follows." },
      { "id": "eggplant-oil", "title": "Eggplant is a sponge", "body": "Raw eggplant is full of tiny air pockets, and it soaks up oil fast. The pan will look dry after a minute. Don't add more oil. Keep cooking, and as the eggplant softens it lets some of the oil back out and turns golden." },
      { "id": "simmer", "title": "Low and slow, then lid off", "body": "Small, lazy bubbles cook the vegetables gently, so they turn soft without breaking into mush. With the lid on, the steam stays in and everything softens. With the lid off at the end, water escapes as steam, and the juices cook down into a thick sauce." }
    ],
    "wrong": [
      { "sign": "The pot looks dry and the eggplant is sticking", "fix": "Turn the heat down a little and stir. Add a spoonful of water, not oil, to loosen the stuck bits." },
      { "sign": "It's soupy at the end", "fix": "Leave the lid off and simmer a few more minutes, stirring now and then, until it thickens." },
      { "sign": "The vegetables turned to mush", "fix": "It still tastes good. Next time, keep the bubbles small and cut the cubes a little bigger." },
      { "sign": "Some cubes are soft and others still hard", "fix": "The cubes were different sizes. Cook a few more minutes until the big ones catch up." }
    ],
    "quiz": [
      { "q": "The eggplant soaked up all the oil and the pot looks dry. What do you do?", "choices": ["Add lots more oil", "Keep cooking and stirring", "Take it off the heat"], "answer": 1, "explain": "As the eggplant softens, it lets some oil back out." },
      { "q": "Why do you take the lid off near the end?", "choices": ["To cool it down", "So the juices cook down and thicken", "So it doesn't burn"], "answer": 1, "explain": "With the lid off, water escapes as steam, and the sauce thickens." }
    ]
  },
  "ingredients": [
    { "ingredient": "eggplant", "amount": 1, "unit": "count", "round": "up", "group": "Vegetables" },
    { "ingredient": "zucchini", "amount": 2, "unit": "count", "round": "up", "group": "Vegetables" },
    { "ingredient": "bell-pepper-red", "amount": 2, "unit": "count", "round": "up", "group": "Vegetables" },
    { "ingredient": "onion-yellow", "amount": 1, "unit": "count", "round": "up", "group": "Vegetables" },
    { "ingredient": "garlic", "amount": 4, "unit": "count", "round": "up", "group": "Vegetables" },
    { "ingredient": "tomato", "amount": 4, "unit": "count", "round": "up", "group": "Vegetables" },
    { "ingredient": "olive-oil", "amount": 3, "unit": "tbsp", "group": "For the eggplant" },
    { "ingredient": "salt", "amount": 0.5, "unit": "tsp", "group": "For the eggplant" },
    { "ingredient": "olive-oil", "amount": 2, "unit": "tbsp", "group": "For the stew" },
    { "ingredient": "thyme-dried", "amount": 1, "unit": "tsp", "group": "For the stew" },
    { "ingredient": "oregano-dried", "amount": 0.5, "unit": "tsp", "group": "For the stew" },
    { "ingredient": "salt", "amount": 1, "unit": "tsp", "group": "For the stew" },
    { "ingredient": "black-pepper", "amount": 0.25, "unit": "tsp", "group": "For the stew" },
    { "ingredient": "basil", "amount": 0.25, "unit": "cup", "prep": "leaves", "optional": true, "group": "To serve" },
    { "ingredient": "baguette", "amount": 1, "unit": "count", "round": "up", "optional": true, "group": "To serve" }
  ],
  "equipment": [
    "chef-knife",
    "cutting-board",
    "colander",
    "mixing-bowl-large",
    "mixing-bowl-medium",
    "small-bowl",
    "measuring-spoons",
    "pot-large",
    "wooden-spoon",
    "oven-mitts"
  ],
  "steps": [
    { "id": "wash", "text": "Rinse all the vegetables in the colander and dry them.", "safety": "solo" },
    { "id": "eggplant", "text": "Cut the ends off the eggplant. Cut it in half the long way and lay each half flat side down. Cut it into planks about ¾ inch thick, cut the planks into sticks, then cut across the sticks to dice it into cubes. Put them in the medium bowl.", "safety": "adult-nearby", "hazard": "Sharp knife", "why": "flat-first", "tip": "These cubes are bigger than a pea, about the size of a game die. Eggplant shrinks a lot as it cooks." },
    { "id": "zucchini", "text": "Cut the ends off the zucchini. Cut each one in half the long way, lay it flat side down, and cut it into long sticks. Line the sticks up and cut across them into cubes the same size as the eggplant. Put them in the large bowl.", "safety": "adult-nearby", "hazard": "Sharp knife", "why": "grid", "tip": "Hold the food with your hand shaped like a claw: fingertips tucked under, knuckles in front." },
    { "id": "pepper", "text": "Cut the top and bottom off each pepper. Stand it up, cut down one side, and open it out flat. Cut away the seeds and white ribs. Lay it skin side down, cut it into strips, then cut across the strips into small squares. Add them to the large bowl.", "safety": "adult-nearby", "hazard": "Sharp knife", "tip": "Skin side down, so the knife doesn't slip on the shiny skin." },
    { "id": "onion", "text": "Cut the onion in half through the root and peel it, leaving the root on. Lay each half flat side down, cut strips toward the root without cutting through it, then cut across the strips to dice it. Add it to the large bowl.", "safety": "adult-nearby", "hazard": "Sharp knife", "tip": "The root holds the layers together while you cut." },
    { "id": "garlic", "text": "Peel the garlic and mince it into tiny bits. Put it in the small bowl.", "safety": "adult-nearby", "hazard": "Sharp knife" },
    { "id": "tomatoes", "text": "Cut each tomato into quarters, lay them skin side down, and dice them, juice and seeds and all. Scrape them onto the garlic.", "safety": "adult-nearby", "hazard": "Sharp knife", "tip": "Keep the seeds and juice this time. In a stew they cook down into the sauce." },
    { "id": "brown-eggplant", "text": "Heat the oil for the eggplant in the pot over medium-high heat until it shimmers. Add the eggplant and {qty:salt} salt. Cook, stirring every minute or so, until the cubes are soft and golden at the edges.", "safety": "adult-nearby", "hazard": "Hot oil", "timerSeconds": 480, "timerLabel": "Brown eggplant", "why": "eggplant-oil", "look": "Golden edges, and the cubes squash easily when you press one with the spoon." },
    { "id": "eggplant-out", "text": "Spoon the eggplant back into the medium bowl.", "safety": "adult-nearby", "hazard": "Hot pot" },
    { "id": "soften", "text": "Add the oil for the stew to the pot, then the onion, pepper, and zucchini. Cook, stirring now and then, until the onion is soft and see-through.", "safety": "adult-nearby", "hazard": "Hot oil", "timerSeconds": 360, "timerLabel": "Onion, pepper, zucchini" },
    { "id": "season", "text": "Push the vegetables to the sides. Put the thyme and oregano in the empty middle of the pot and stir them into the oil for a few seconds, then stir everything together.", "safety": "adult-nearby", "hazard": "Hot pot", "tip": "Dried herbs wake up when they touch hot oil. You'll smell it right away." },
    { "id": "tomatoes-in", "text": "Add the eggplant back, with the tomatoes and garlic, the stew's salt, and the pepper. Stir and let it come up to bubbling.", "safety": "adult-nearby", "hazard": "Hot pot", "look": "Bubbles all over the top." },
    { "id": "simmer-lid", "text": "Turn the heat down to low and put the lid on. Let it simmer, stirring once or twice.", "safety": "adult-nearby", "hazard": "Hot pot", "timerSeconds": 1200, "timerLabel": "Simmer, lid on", "why": "simmer", "look": "Small, lazy bubbles that pop now and then.", "tip": "Lift the lid away from you, so the steam doesn't hit your face." },
    { "id": "simmer-open", "text": "Take the lid off and keep simmering, stirring now and then, until the juices cook down and thicken.", "safety": "adult-nearby", "hazard": "Hot pot", "timerSeconds": 600, "timerLabel": "Simmer, lid off", "why": "simmer", "look": "A thick, glossy sauce, with no pool of thin liquid at the bottom." },
    { "id": "taste", "text": "Turn off the stove. Taste a little on a clean spoon, after blowing on it, and add a pinch more salt if it needs it.", "safety": "adult-nearby", "hazard": "Hot pot", "tip": "Stews are very hot inside. Let a spoonful cool for a moment before tasting." },
    { "id": "serve", "text": "Tear the basil leaves over the top if you're using them. Serve in bowls, with slices of baguette for scooping up the sauce.", "safety": "solo", "tip": "Ratatouille tastes even better the next day, warmed up or at room temperature." }
  ]
}
