{
  "id": "spatchcocked-quail",
  "version": 1,
  "track": "core",
  "unit": 104,
  "title": "Spatchcocked quail with pomegranate",
  "image": "dishes/spatchcocked-quail.png",
  "cuisine": "persian",
  "skill": "Spatchcocking a small bird",
  "skills": ["breaking-down-chicken", "roasting"],
  "prereqs": [],
  "servings": 4,
  "totalMinutes": 75,
  "scaling": {
    "mode": "free",
    "notes": [
      { "from": 5, "text": "For more than 4, roast the quail on two sheet pans, one on each middle rack, swapping them halfway." }
    ]
  },
  "learn": {
    "move": {
      "title": "Flatten it, glaze it, roast it hot",
      "body": "Quail are small, clean birds, and Persian cooks roast them with sour-sweet pomegranate molasses and warm spices. You'll spatchcock eight quail, cutting out the backbone and pressing each bird flat, so they roast evenly in 15 minutes at high heat. They're served over a bulgur pilaf with herbs."
    },
    "why": [
      { "id": "spatchcock", "title": "Out with the backbone", "body": "Spatchcocking means cutting out the backbone with shears and pressing the bird flat. A flat bird has no thick middle hiding inside a hollow cavity, so the legs and breast finish at the same time." },
      { "id": "thaw", "title": "Thaw in the fridge", "body": "Most quail are sold frozen. A day in the fridge thaws them all the way through, so they roast evenly; a bird icy in the middle stays raw there while the outside dries." },
      { "id": "glaze", "title": "A glaze that clings", "body": "Pomegranate molasses is pomegranate juice boiled down to a thick, tart syrup. Mixed with oil and spices, it clings to the skin and browns quickly at high heat, so it goes on in two coats." },
      { "id": "hot", "title": "Small bird, high heat", "body": "A quail weighs about 4 ounces. At 450°F it browns outside in the same 12 to 15 minutes it takes to cook through, which a lower oven can't do." },
      { "id": "165", "title": "Quail at 165°F", "body": "All poultry is 165°F in this app. On a quail, check the thickest part of the breast from the side, close to the bone." }
    ],
    "wrong": [
      { "sign": "The glaze burned", "fix": "It went on too thick or too early. Brush on the second coat only for the last 5 minutes." },
      { "sign": "The legs are done but the breast isn't", "fix": "The bird wasn't pressed flat enough. Press harder on the breastbone next time." },
      { "sign": "The quail is still icy inside", "fix": "It wasn't fully thawed. Roast 3 more minutes and check again." },
      { "sign": "The bulgur is mushy", "fix": "Too much liquid. Next time, use the exact amount and don't stir while it soaks." }
    ],
    "quiz": [
      { "q": "What does spatchcock mean?", "choices": ["Cut out the backbone and press the bird flat", "Tie the legs together", "Stuff the bird"], "answer": 0, "explain": "Flat birds roast evenly." },
      { "q": "Why roast quail at 450°F?", "choices": ["A small bird browns outside in the time it takes to cook through", "It's faster to clean up", "The glaze needs it"], "answer": 0, "explain": "Small bird, high heat." },
      { "q": "Is quail a clean bird?", "choices": ["Yes", "No", "Only farm-raised"], "answer": 0, "explain": "God sent quail to Israel (Exodus 16:13)." }
    ]
  },
  "ingredients": [
    { "ingredient": "quail-whole", "amount": 2, "unit": "lb", "group": "Quail", "prep": "8 birds, thawed" },
    { "ingredient": "salt", "amount": 1, "unit": "tsp", "group": "Quail" },
    { "ingredient": "pomegranate-molasses", "amount": 3, "unit": "tbsp", "group": "Glaze" },
    { "ingredient": "olive-oil", "amount": 2, "unit": "tbsp", "group": "Glaze" },
    { "ingredient": "garlic", "amount": 2, "unit": "count", "group": "Glaze", "round": "up" },
    { "ingredient": "cinnamon-ground", "amount": 0.5, "unit": "tsp", "group": "Glaze" },
    { "ingredient": "cumin-ground", "amount": 0.5, "unit": "tsp", "group": "Glaze" },
    { "ingredient": "black-pepper", "amount": 0.25, "unit": "tsp", "group": "Glaze" },
    { "ingredient": "bulgur-fine", "amount": 1.5, "unit": "cup", "group": "Bulgur pilaf" },
    { "ingredient": "broth-chicken", "amount": 1.5, "unit": "cup", "group": "Bulgur pilaf" },
    { "ingredient": "butter-unsalted", "amount": 1, "unit": "tbsp", "group": "Bulgur pilaf" },
    { "ingredient": "salt", "amount": 0.5, "unit": "tsp", "group": "Bulgur pilaf" },
    { "ingredient": "parsley", "amount": 0.5, "unit": "cup", "group": "Bulgur pilaf", "prep": "chopped" },
    { "ingredient": "mint", "amount": 0.25, "unit": "cup", "group": "Bulgur pilaf", "prep": "chopped" },
    { "ingredient": "lemon", "amount": 1, "unit": "count", "group": "Bulgur pilaf", "round": "up" }
  ],
  "equipment": [
    "kitchen-shears",
    "cutting-board",
    "paper-towels",
    "plate",
    "sheet-pan",
    "foil",
    "oven-mitts",
    "small-bowl",
    "pastry-brush",
    "saucepan-medium",
    "mixing-bowl-medium",
    "measuring-cups",
    "liquid-measuring-cup",
    "measuring-spoons",
    "chef-knife",
    "fork",
    "tongs",
    "thermometer"
  ],
  "steps": [
    { "id": "oven", "text": "Heat the oven to 450°F with a rack in the upper third. Line the sheet pan with foil.", "safety": "solo", "hazard": "Hot oven", "why": "hot" },
    { "id": "glaze", "text": "Mince the garlic and stir it into the pomegranate molasses, oil, cinnamon, cumin, and pepper in the small bowl. Pour half into a second bowl for the second coat.", "safety": "solo", "hazard": "Sharp knife" },
    { "id": "thawed", "text": "Check that the quail are thawed: no ice in the cavity. Don't rinse them.", "safety": "solo", "hazard": "Raw poultry", "why": "thaw" },
    { "id": "spatchcock", "text": "Lay each bird breast down. Cut along both sides of the backbone with the shears and lift it out. Turn the bird over and press the breastbone until it cracks flat. Pat dry and salt both sides.", "safety": "solo", "hazard": "Shears, raw poultry", "handles": ["quail-whole"], "why": "spatchcock", "look": "Eight flat birds, legs out to the sides." },
    { "id": "wash-spatchcock", "text": "Freeze the backbones for stock. Wash your hands, the shears, and the board with hot, soapy water.", "safety": "solo", "type": "wash", "hazard": "Raw poultry" },
    { "id": "first-coat", "text": "Lay the birds skin side up on the pan with the tongs and brush them with the first half of the glaze.", "safety": "solo", "hazard": "Raw poultry", "handles": ["quail-whole"], "why": "glaze" },
    { "id": "wash-coat", "text": "Wash the brush, the tongs, and your hands. Throw out any glaze left in the first bowl.", "safety": "solo", "type": "wash", "hazard": "Raw poultry" },
    { "id": "bulgur", "text": "Bring the broth, butter, and the pilaf's salt to a boil in the saucepan. Stir in the bulgur, cover, and take it off the heat to soak while the quail roast.", "safety": "solo", "hazard": "Hot pot", "timerSeconds": 900, "timerLabel": "Bulgur soaks" },
    { "id": "roast", "text": "Roast, then brush with the second coat and roast until deep brown.", "safety": "solo", "hazard": "Hot oven", "timerSeconds": 840, "timerLabel": "Roast quail", "look": "Lacquered, deep brown skin." },
    { "id": "check", "text": "Check the thickest breast, from the side, near the bone: at least 165°F. If not, roast 2 minutes more.", "safety": "solo", "type": "doneness", "hazard": "Hot oven", "target": { "temp": 165, "unit": "F" }, "why": "165" },
    { "id": "pilaf", "text": "Fluff the bulgur with the fork into the medium bowl, and gently stir in the parsley, mint, and the lemon's juice.", "safety": "solo", "look": "Separate, tender grains." },
    { "id": "serve", "text": "Serve two quail per person over the pilaf, with the pan juices spooned on top.", "safety": "solo" }
  ]
}
