{"id":"tahdig","version":1,"track":"core","unit":104,"title":"Chelow with tahdig","image":"dishes/tahdig.png","cuisine":"persian","skill":"Steamed rice with a crisp bottom","skills":["cooking-grains"],"prereqs":[],"servings":8,"totalMinutes":120,"scaling":{"mode":"fixed","multipliers":[1],"notes":{"1":"One heavy 5-quart nonstick pot. The crust only forms evenly at this size."}},"learn":{"move":{"title":"Parboil, steam, and a golden crust","body":"Chelow is Persian steamed rice: basmati parboiled in well-salted water, drained, then steamed so every grain stands apart. Tahdig, the bottom of the pot, is the prize: a golden crust formed over a layer of saffron yogurt rice. You'll parboil to the right bite, build the base, steam under a towel-wrapped lid, and turn the whole pot out onto a platter."},"why":[{"id":"soak","title":"Rinse and soak","body":"Rinsing removes surface starch; a 30-minute soak lets the grains absorb water, so they lengthen instead of breaking."},{"id":"parboil","title":"Parboil to al dente","body":"Boiled in plenty of salted water until soft outside with a firm, white core, then drained. The rest of the cooking is steam."},{"id":"towel","title":"The towel lid","body":"A clean towel wrapped around the lid absorbs condensation, so water doesn't drip back and make the rice soggy. Tie its corners up over the handle, well away from the burner."},{"id":"crust","title":"Heat for the crust","body":"Medium-high heat for the first 10 minutes starts the crust; low heat for the next 40 lets it turn golden while the rice above steams."}],"wrong":[{"sign":"The crust stuck","fix":"Set the pot base in cold water in the sink for 2 minutes; the steam loosens it. Use a nonstick pot next time."},{"sign":"The rice is mushy","fix":"It parboiled too long. Pull it while the core is still white."},{"sign":"The crust is pale","fix":"Return it to medium heat for 5 minutes, checking the edge."}],"quiz":[{"q":"Why tie the towel's corners above the lid?","choices":["So they can't reach the burner and catch fire","For looks","To hold the steam in"],"answer":0,"explain":"It sits well away from the flame."},{"q":"When do you drain the parboiled rice?","choices":["Soft outside with a firm, white core","Fully soft","Still hard"],"answer":0,"explain":"Steam finishes it."},{"q":"What forms the crust?","choices":["Saffron yogurt rice on a hot, oiled pot base","Burnt rice","Butter alone"],"answer":0,"explain":"Over high, then low heat."}]},"ingredients":[{"ingredient":"rice-basmati","amount":3,"unit":"cup","group":"Rice"},{"ingredient":"water","amount":16,"unit":"cup","prep":"for parboiling","group":"Rice"},{"ingredient":"salt","amount":3,"unit":"tbsp","group":"Rice"},{"ingredient":"saffron","amount":0.25,"unit":"tsp","prep":"crushed","group":"Tahdig"},{"ingredient":"water","amount":3,"unit":"tbsp","prep":"hot, for the saffron","group":"Tahdig"},{"ingredient":"yogurt-greek","amount":0.5,"unit":"cup","group":"Tahdig"},{"ingredient":"vegetable-oil","amount":3,"unit":"tbsp","group":"Tahdig"},{"ingredient":"butter-unsalted","amount":4,"unit":"tbsp","group":"Tahdig"}],"equipment":["mixing-bowl-large","colander","stockpot","pot-large","small-bowl","measuring-cups","liquid-measuring-cup","measuring-spoons","spoon","kitchen-towel","oven-mitts","plate","wooden-spoon","spatula"],"steps":[{"id":"rinse","text":"Rinse the rice in the bowl, changing the water until it's nearly clear, then soak it in fresh water.","safety":"solo","timerSeconds":1800,"timerLabel":"Soak","why":"soak"},{"id":"bloom","text":"Crush the saffron and steep it in the hot water.","safety":"solo","timerSeconds":600,"timerLabel":"Bloom saffron","look":"Deep orange liquid."},{"id":"boil","text":"Bring the parboiling water and salt to a rolling boil in the stockpot. Drain the rice and add it.","safety":"solo","hazard":"Boiling water"},{"id":"parboil","text":"Boil, stirring gently once or twice, until the grains are soft outside with a firm core.","safety":"solo","hazard":"Boiling water","timerSeconds":360,"timerLabel":"Parboil","why":"parboil","tip":"Start biting at 5 minutes."},{"id":"drain","text":"Drain in the colander and rinse briefly with lukewarm water.","safety":"solo","hazard":"Boiling water, steam"},{"id":"base","text":"Mix 1½ cups of the rice with the yogurt and half the saffron water. Heat the oil and 1 tablespoon of the butter in the large pot (nonstick is best) and press the yogurt rice over the base in an even layer.","safety":"solo","hazard":"Hot oil","why":"crust"},{"id":"mound","text":"Spoon the rest of the rice over it in a mound. Poke 5 holes to the bottom with the spoon handle. Dot with the remaining butter and spoon over the rest of the saffron water.","safety":"solo","hazard":"Hot pot"},{"id":"lid","text":"Wrap the lid in the towel, tie the corners over the handle, and cover the pot tightly.","safety":"solo","hazard":"Fire","why":"towel","tip":"Keep the towel's corners well above the lid, away from the flame."},{"id":"high","text":"Cook on medium-high.","safety":"solo","hazard":"Hot pot, fire","timerSeconds":600,"timerLabel":"Start crust"},{"id":"low","text":"Lower to the lowest heat and steam.","safety":"solo","hazard":"Hot pot","timerSeconds":2400,"timerLabel":"Steam"},{"id":"check","text":"Lift an edge of the base with a thin spatula.","safety":"solo","type":"doneness","hazard":"Hot pot","target":{"look":"A deep golden crust, and fluffy separate grains above"}},{"id":"flip","text":"Set the pot in 1 inch of cold water in the sink for 1 minute. Cover with a large platter and, with oven mitts, invert in one motion.","safety":"solo","hazard":"Hot pot, steam","look":"A golden, unbroken disk of crust on top."},{"id":"serve","text":"Cut the tahdig into wedges and serve with the chelow.","safety":"solo"}]}
